{
  "$schema": "./schema.json",
  "id": "template_04",
  "name": "Basic Business Card",
  "width": 1050,
  "height": 600,
  "orientation": "horizontal",
  "background": {
    "type": "gradient",
    "color1": "#334155",
    "opacity": 1,
    "rotation": 0,
    "scale": 1,
    "blur": 0,
    "color2": "#020617",
    "gradientType": "radial",
    "gradientStops": [
      {
        "offset": 0,
        "color": "#334155"
      },
      {
        "offset": 1,
        "color": "#020617"
      }
    ]
  },
  "colorRoles": {
    "company_name": "primary-text",
    "company_slogan": "primary-text",
    "full_name": "primary-text",
    "job_title": "primary-text"
  },
  "layers": [
    {
      "id": "diagonal_accent",
      "type": "Polygon",
      "props": {
        "id": "diagonal_accent",
        "points": [
          600,
          0,
          1050,
          0,
          1050,
          600,
          400,
          600
        ],
        "fill": "#2D6B4F",
        "rotation": 0,
        "opacity": 1
      },
      "editable": true,
      "locked": true
    },
    {
      "id": "diagonal_stripe",
      "type": "Polygon",
      "props": {
        "id": "diagonal_stripe",
        "points": [
          550,
          0,
          580,
          0,
          380,
          600,
          350,
          600
        ],
        "fill": "#2D6B4F",
        "rotation": 0,
        "opacity": 0.3
      },
      "editable": true,
      "locked": true
    },
    {
      "id": "logo_icon",
      "type": "Image",
      "props": {
        "id": "logo_icon",
        "x": 224.24242424242422,
        "y": 170.30303030303028,
        "width": 100,
        "height": 100,
        "data": "M12 2c-1.1 0-2 .9-2 2 0 .74.4 1.38 1 1.72V7h-.5C9.12 7 8 8.12 8 9.5c0 .74.4 1.38 1 1.72V13h-.5c-1.38 0-2.5 1.12-2.5 2.5S7.12 18 8.5 18h.5v1.28c-.6.34-1 .98-1 1.72 0 1.1.9 2 2 2s2-.9 2-2c0-.74-.4-1.38-1-1.72V18h.5c1.38 0 2.5-1.12 2.5-2.5S12.88 13 11.5 13H11v-1.78c.6-.34 1-.98 1-1.72 0-1.38-1.12-2.5-2.5-2.5H9V5.72c.6-.34 1-.98 1-1.72 0-1.1-.9-2-2-2zm0 2c.55 0 1 .45 1 1s-.45 1-1 1-1-.45-1-1 .45-1 1-1z",
        "iconName": "Flower",
        "category": "Image",
        "fill": "#4144c0",
        "rotation": 0,
        "opacity": 1,
        "src": "/logos/LogoTaco_Logo-24/SVG/Logo24_White.svg",
        "isLogo": true
      },
      "editable": true,
      "locked": false
    },
    {
      "id": "company_name",
      "type": "Text",
      "props": {
        "id": "company_name",
        "x": 63.63636363636355,
        "y": 309.393939393939,
        "width": 421.21212121212136,
        "height": 55.757575757576134,
        "text": "LOGO TEXT HERE",
        "fontSize": 45,
        "fontFamily": "Montserrat",
        "fill": "#E0E0E0",
        "rotation": 0,
        "opacity": 1,
        "align": "left",
        "fontStyle": "bold"
      },
      "editable": true,
      "locked": false
    },
    {
      "id": "company_slogan",
      "type": "Text",
      "props": {
        "id": "company_slogan",
        "x": 183.63636363636354,
        "y": 371.81818181818,
        "width": 281.2121212121214,
        "height": 56.969696969698454,
        "text": "SLOGAN HERE",
        "fontSize": 29,
        "fontFamily": "Open Sans",
        "fill": "#E0E0E0",
        "rotation": 0,
        "opacity": 1,
        "align": "left"
      },
      "editable": true,
      "locked": false
    },
    {
      "id": "full_name",
      "type": "Text",
      "props": {
        "id": "full_name",
        "x": 616.060606060608,
        "y": 199.69696969696957,
        "width": 408.4848484848463,
        "height": 89.69696969696982,
        "text": "FULL NAME",
        "fontSize": 85,
        "fontFamily": "Impact",
        "fill": "#FFFFFF",
        "rotation": 0,
        "opacity": 1,
        "align": "left",
        "fontStyle": "bold"
      },
      "editable": true,
      "locked": false
    },
    {
      "id": "job_title",
      "type": "Text",
      "props": {
        "id": "job_title",
        "x": 670.1515151515157,
        "y": 314.84848484848186,
        "width": 300.30303030303105,
        "height": 56.96969696969816,
        "text": "Founder & CEO",
        "fontSize": 37,
        "fontFamily": "Roboto",
        "fill": "#E0E0E0",
        "rotation": 0,
        "opacity": 1,
        "align": "left"
      },
      "editable": true,
      "locked": false
    }
  ],
  "groups": [],
  "thumbnail": "",
  "preview": "",
  "tags": [
    "minimal",
    "basic",
    "simple"
  ],
  "category": "minimal",
  "colors": [
    "#2D6B4F",
    "#4144c0",
    "#E0E0E0",
    "#FFFFFF"
  ],
  "features": []
}